[{"anonymous": ["Giricek", "Korver", "Korver", "Stefanski"], "word_count": "168", "_id": "548990bc7988104c1745b2ce", "persons": ["Gordan Giricek", "Kyle Korver", "Giricek", "Ed Stefanski", "Korver", "Korver", "Kyle", "Stefanski"], "female": ["Kyle", "Kyle"], "pub_date": "2007-12-30T00:00:00Z", "subject": ["Basketball"], "organizations": ["Philadelphia 76ers", "Utah Jazz"], "news_desk": "Sports", "lead_paragraph": "The Philadelphia 76ers acquired guard Gordan Giricek and a first-round draft pick from the Utah Jazz for guard Kyle Korver on Saturday.The 6-foot-5 Giricek averaged 4.3 points in 22 games for the Jazz this season and has career average of 9.8 in six seasons.\u201cWe are excited about acquiring a player of Gordan\u2019s ability, as well as an additional asset in the form of a first-round draft pick,\u201d 76ers General Manager Ed Stefanski said. \u201cThis move will provide us with increased salary-cap flexibility this off-season and also allows us to continue our evaluation and development of the young talent we have on this team.\u201dKorver averaged 10 points in 25 games with the 76ers and was their top 3-point threat. In four seasons with Philadelphia, Korver averaged 10.5 points and shot 42 percent.\u201cI want to thank Kyle for the positive impact he has made on this team and the city of Philadelphia through his play on the court and, even more importantly, his philanthropic efforts off of it,\u201d Stefanski said.", "snippet": "The Philadelphia 76ers acquired guard Gordan Giricek and a first-round draft pick from the Utah Jazz for guard Kyle Korver on Saturday.The 6-foot-5 Giricek averaged 4.3 points in 22 games for the Jazz this season and has career average of 9.8 in six...", "subsection_name": "Pro Basketball", "male": ["Gordan", "Ed"]}]