[{"anonymous": ["Paige", "Ragone", "Paige", "Paige"], "word_count": "122", "_id": "548bf61879881004157bc3f1", "persons": ["Rita Ragone", "Woody Paige", "Jay Crawford", "Paige", "Crawford", "Ragone", "Paige", "Paige"], "female": ["Rita"], "pub_date": "2007-06-29T00:00:00Z", "subject": ["Sexual Harassment"], "organizations": ["ESPN"], "news_desk": "Sports", "lead_paragraph": "A woman who worked on the set of the ESPN talk show \u201cCold Pizza\u201d is suing the network, saying she was fired after complaining about sexual harassment by the show\u2019s host and a regular panelist. In the suit, the makeup artist Rita Ragone said she was pinched and fondled by the sports commentator Woody Paige and subjected to crude sexual comments by the ESPN host Jay Crawford at the show\u2019s studio in Manhattan. Paige and Crawford were named as defendants in the suit. Ragone said Paige once grabbed her backside so forcefully, she was \u201cpropelled forward and into the air.\u201d\u201cIt is not true,\u201d Paige said in an e-mail message. He declined further comment. An ESPN spokesman also said the allegations were false.", "snippet": "A woman who worked on the set of the ESPN talk show \u201cCold Pizza\u201d is suing the network, saying she was fired after complaining about sexual harassment by the show\u2019s host and a regular panelist. In the suit, the makeup artist Rita Ragone said she...", "subsection_name": null, "male": ["Woody", "Jay", "Crawford"]}]