[{"anonymous": ["Sanya", "Richards", "Trotter"], "word_count": "107", "_id": "548bbd2079881004157bbee1", "persons": ["Sanya Richards", "Richards", "Dee Dee Trotter", "Natasha Hastings", "Mary Wineberg", "Trotter", "Angelo Taylor", "LaShawn Merritt", "Taylor"], "female": ["Dee", "Natasha", "Mary", "LaShawn"], "pub_date": "2007-06-24T00:00:00Z", "subject": ["Track and Field"], "organizations": ["Merritts"], "news_desk": "Sports", "lead_paragraph": "Sanya Richards failed to make the 400-meter team for the world championships yesterday, finishing fourth in the event on a damp track at the United States track and field championships in Indianapolis. The loss broke a string of 18 outdoor victories in the 400 for Richards. Dee Dee Trotter won the 400 in a personal-best 49.64 seconds. Natasha Hastings was second in a college-record 49.84 and Mary Wineberg third at 50.24. Trotter came from third on the final turn to pull away.In the men\u2019s 400, Angelo Taylor edged LaShawn Merritt at the finish. Taylor, the Olympic champion in the 400 hurdles, won at 44.05 to Merritt\u2019s 44.06.", "snippet": "Sanya Richards failed to make the 400-meter team for the world championships yesterday, finishing fourth in the event on a damp track at the United States track and field championships in Indianapolis. The loss broke a string of 18 outdoor victories...", "subsection_name": "More Sports", "male": ["Angelo", "Taylor"]}]