[{"anonymous": ["Gallardo"], "word_count": "102", "_id": "547d59c4798810275e3845ca", "persons": ["Marcelo Gallardo", "Jose Carvallo", "Gonzalo Peralta", "Gallardo", "Christian G\u00f3mez", "Gonzalo Martinez", "Franco Niell"], "female": [], "pub_date": "2008-01-29T00:00:00Z", "subject": ["Soccer"], "organizations": ["DC United"], "news_desk": "Sports", "lead_paragraph": "The Argentine midfielder Marcelo Gallardo signed with D.C. United on Monday, becoming the biggest of five South American additions to the club in the past week.The team also added the Peruvian goalkeeper Jose Carvallo, 21, and the Argentine defender Gonzalo Peralta, 27, on Monday as it held its first preseason practice.The 32-year-old Gallardo played in the 1998 and 2002 World Cups. He will fill the central playmaker\u2019s role previously held by Christian G\u00f3mez, Major League Soccer\u2019s most valuable player in 2006. United is expected to trade G\u00f3mez.Last week, United signed the Colombian defender Gonzalo Martinez and obtained the Argentine forward Franco Niell.", "snippet": "The Argentine midfielder Marcelo Gallardo signed with D.C. United on Monday, becoming the biggest of five South American additions to the club in the past week.The team also added the Peruvian goalkeeper Jose Carvallo, 21, and the Argentine defender...", "subsection_name": "Soccer", "male": ["Marcelo", "Jose", "Gonzalo", "Christian", "Gonzalo", "Franco"]}]