[{"anonymous": ["Baldonado", "Ashaolu"], "word_count": "103", "_id": "5486c68d7988101981f9f75e", "persons": ["Scott Lee", "Baldonado", "Aaron Jackson", "Shawn James", "Kojo Mensah", "Sam Ashaolu", "Ashaolu", "Lee", "Wendy Williams"], "female": ["Wendy"], "pub_date": "2007-10-24T00:00:00Z", "subject": null, "organizations": ["Duquesne"], "news_desk": "Sports", "lead_paragraph": "One of the two men accused of shooting at five Duquesne players last year pleaded guilty to five counts of attempted homicide and three other counts yesterday in Pittsburgh.Derek Scott Lee, 19, of Pittsburgh, was sentenced to 7 to 14 years in prison.Stuard Baldonado, Aaron Jackson, Shawn James, Kojo Mensah and Sam Ashaolu were shot early Sept. 17, 2006, as they returned from a dance. Ashaolu was shot twice in the head, but survived.Lee has not agreed to cooperate with the authorities; he pleaded guilty because he faced more than 100 years in jail if convicted at trial, said Lee&#8217;s lawyer, Wendy Williams.", "snippet": "One of the two men accused of shooting at five Duquesne players last year pleaded guilty to five counts of attempted homicide and three other counts yesterday in Pittsburgh.Derek Scott Lee, 19, of Pittsburgh, was sentenced to 7 to 14 years in...", "subsection_name": "College Basketball", "male": ["Scott", "Aaron", "Shawn", "Kojo", "Sam", "Lee"]}]