[{"anonymous": ["Jennings", "N.", "Jennings", "Jennings"], "word_count": "133", "_id": "5485bdde79881040e1d4c830", "persons": ["Melissa Jennings", "Anson Dorrance", "Jennings", "N. Carlton Tilley Jr.", "Jennings", "Jennings"], "female": ["Melissa"], "pub_date": "2007-10-02T00:00:00Z", "subject": null, "organizations": ["United States Supreme Court", "University of North Carolina", "United States Circuit Court of Appeals", "Supreme Court"], "news_desk": "Sports", "lead_paragraph": "The United States Supreme Court denied a petition to hear arguments in the sexual harassment case against the women&#8217;s coach at the University of North Carolina at Chapel Hill, knocking down the final legal barrier to a jury trial. The former player Melissa Jennings first sued Coach Anson Dorrance in 1998, saying he maintained a hostile environment filled with sexual harassment. Jennings, a former backup goalkeeper, said the abuse violated Title IX by denying her the benefits of collegiate sports.United States District Court Judge N. Carlton Tilley Jr. in Greensboro, N.C., had dismissed Jennings&#8217;s lawsuit in October 2004, but the 4th United States Circuit Court of Appeals resurrected the case earlier this year, saying Jennings deserved a trial to hear the claims. The Supreme Court order puts the case back in Tilley&#8217;s court.", "snippet": "The United States Supreme Court denied a petition to hear arguments in the sexual harassment case against the women&#8217;s coach at the University of North Carolina at Chapel Hill, knocking down the final legal barrier to a jury trial. The former...", "subsection_name": "Soccer", "male": ["Anson"]}]