[{"anonymous": ["Jokinen", "Jokinens"], "word_count": "158", "_id": "5486cfbc7988101981f9f887", "persons": ["Chris Clark", "Alex Ovechkin", "Eric Staal", "Jeff Hamilton", "Cory Stillman", "Bret Hedican", "Jokinen", "Jokinens", "Tomas Holmstrom", "Matt Ellis"], "female": [], "pub_date": "2007-10-25T00:00:00Z", "subject": null, "organizations": ["Tampa Bay Lightning", "Carolina Hurricanes", "Sabres", "Philadelphia Flyers", "Red Wings", "Vancouver Canucks"], "news_desk": "Sports", "lead_paragraph": "The Washington captain Chris Clark scored his first two goals last night, and the Capitals\u2019 juggled lineup produced the team\u2019s highest output of the season in a 5-3 win over the visiting Tampa Bay Lightning. Alex Ovechkin had two assists and an empty-net goal with four seconds left to help the Capitals end a four-game losing streak.In other games, Eric Staal, Jeff Hamilton, Cory Stillman and Bret Hedican scored third-period goals as the Carolina Hurricanes defeated visiting Buffalo, 6-2, for their first victory over the Sabres since Game 7 of the 2006 Eastern Conference finals.Olli Jokinen scored twice to become Florida\u2019s career leader in goals and points as the host Panthers edged the Philadelphia Flyers, 4-3. Jokinen\u2019s first goal was his 355th point with the Panthers and his second goal was his 158th.Tomas Holmstrom scored his sixth and seven goals, and Matt Ellis also had a goal, as the Red Wings defeated the Vancouver Canucks, 3-2, in Detroit.", "snippet": "The Washington captain Chris Clark scored his first two goals last night, and the Capitals\u2019 juggled lineup produced the team\u2019s highest output of the season in a 5-3 win over the visiting Tampa Bay Lightning. Alex Ovechkin had two assists and an...", "subsection_name": "Hockey", "male": ["Chris", "Alex", "Eric", "Jeff", "Cory", "Bret", "Tomas", "Matt"]}]