[{"anonymous": ["Iginla", "Aucoin", "Jokinen"], "word_count": "268", "_id": "5486d0d27988101981f9f8a8", "persons": ["Adrian Aucoin", "Iginla", "Dion Phaneuf", "Alex Tanguay", "Aucoin", "Robyn Regehr", "Chris Clark", "Alex Ovechkin", "Eric Staal", "Jeff Hamilton", "Cory Stillman", "Bret Hedican", "Olli Jokinen", "Jokinen", "Tomas Holmstrom", "Matt Ellis"], "female": ["Robyn"], "pub_date": "2007-10-25T00:00:00Z", "subject": null, "organizations": ["Calgary Flames", "Los Angeles.The Flames", "Tampa Bay Lightning", "Carolina Hurricanes", "Sabres", "Philadelphia Flyers", "Red Wings", "Vancouver Canucks"], "news_desk": "Sports", "lead_paragraph": "Adrian Aucoin scored the go-ahead goal early in the third period last night, and the Calgary Flames beat visiting Minnesota, 5-3, handing the Wild its first regulation loss in nine games this season.Minnesota earned 15 of 16 available points in its first eight games, winning seven times and dropping a shootout decision at Los Angeles.The Flames rallied after falling behind, 3-0, in the first 10 minutes.Jarome Iginla and Dion Phaneuf got the rally started with power-play goals in the second period, and Alex Tanguay tied the score later in the period. Aucoin gave Calgary the lead at 3 minutes 46 seconds of the third, and Robyn Regehr added a goal at 8:03. In other games: &#182;The Washington captain Chris Clark scored his first two goals, and the Capitals&#8217; juggled lineup produced the team&#8217;s highest output of the season in a 5-3 win over the visiting Tampa Bay Lightning. Alex Ovechkin had two assists and an empty-net goal with four seconds left to help the Capitals end a four-game losing streak.&#182;Eric Staal, Jeff Hamilton, Cory Stillman and Bret Hedican scored third-period goals as the Carolina Hurricanes defeated visiting Buffalo, 6-2, for their first victory over the Sabres since Game 7 of the 2006 Eastern Conference finals.&#182;Olli Jokinen scored twice to become Florida&#8217;s career leader in goals and points as the host Panthers edged the Philadelphia Flyers, 4-3. Jokinen&#8217;s first goal was his 355th point with the Panthers and his second goal was his 158th.&#182;Tomas Holmstrom scored his sixth and seven goals, and Matt Ellis also had a goal, as the Red Wings defeated the Vancouver Canucks, 3-2, in Detroit.", "snippet": "Adrian Aucoin scored the go-ahead goal early in the third period last night, and the Calgary Flames beat visiting Minnesota, 5-3, handing the Wild its first regulation loss in nine games this season.Minnesota earned 15 of 16 available points in its...", "subsection_name": "Hockey", "male": ["Adrian", "Dion", "Alex", "Chris", "Alex", "Eric", "Jeff", "Cory", "Bret", "Olli", "Tomas", "Matt"]}]