[{"anonymous": ["Villegas", "Villegas"], "word_count": "122", "_id": "5476869b798810357102fb46", "persons": ["Sammy Villegas", "Villegas", "Villegas"], "female": [], "pub_date": "2008-08-07T00:00:00Z", "subject": ["Basketball", "Bribery"], "organizations": ["Toledo", "Toledo", "United States District Court"], "news_desk": "Sports", "lead_paragraph": "A former Toledo basketball player was charged with fixing games, a little over a year after a former Toledo football player was charged with point-shaving, according to a federal bill of information filed in the United States District Court in Detroit. Sammy Villegas, who played for four years at Toledo, is accused of shaving points in games during the 2004-5 and 2005-6 seasons. Villegas, a guard who finished his career in 2006, also paid money to another player who took part in the point-shaving scheme, prosecutors said. The other player was not charged or named in the bill. Villegas was charged with conspiracy to influence sports contests by bribery. Prosecutors said he received money and other gifts in exchange for fixing games.", "snippet": "A former Toledo basketball player was charged with fixing games, a little over a year after a former Toledo football player was charged with point-shaving, according to a federal bill of information filed in the United States District Court in...", "subsection_name": "College Basketball", "male": ["Sammy"]}]