[{"anonymous": ["Sauter", "Busch", "Sauter"], "word_count": "121", "_id": "548c30f579881004157bc927", "persons": ["Kyle Busch", "Johnny Sauter", "Sauter", "Busch", "Sauter", "Alan Gustafson", "Robert Barker", "Rick Hendrick", "Joe Custer"], "female": ["Kyle"], "pub_date": "2007-07-05T00:00:00Z", "subject": null, "organizations": ["Chevrolet of Busch"], "news_desk": "Sports", "lead_paragraph": "Nascar has penalized the Nextel Cup teams of Kyle Busch and Johnny Sauter for rule infractions found on their cars during the postrace inspection after Sunday&#8217;s race at New Hampshire International Speedway. The No. 5 Chevrolet of Busch and the No. 70 Chevrolet of Sauter were found to have used unapproved parts and failed to meet the minimum front car heights.Nascar officials said yesterday that Busch and Sauter were each penalized 25 points and that their respective crew chiefs, Alan Gustafson and Robert Barker, were each fined $25,000 and placed on probation until Sept. 19.In addition, Rick Hendrick, the owner of the No. 5, was penalized 25 car owner championship points, as was Joe Custer, the owner of the No. 70.", "snippet": "Nascar has penalized the Nextel Cup teams of Kyle Busch and Johnny Sauter for rule infractions found on their cars during the postrace inspection after Sunday&#8217;s race at New Hampshire International Speedway. The No. 5 Chevrolet of Busch and the...", "subsection_name": "More Sports", "male": ["Johnny", "Alan", "Robert", "Rick", "Joe"]}]