[{"anonymous": ["Darcis", "Eschauer", "Szavay", "Akgul", "Chakvetadze", "Sania"], "word_count": "155", "_id": "548ce2fe798810543aba4c2e", "persons": ["Werner Eschauer", "Steve Darcis", "Darcis", "Mikhail Youzhny", "Eschauer", "Robin Haase", "Agnes Szavay", "Sara Errani", "Szavay", "Martina", "Karin Knapp", "Akiko Morigami", "Akgul Amanmuradova", "Anna Chakvetadze", "Chakvetadze", "Sania Mirza"], "female": ["Agnes", "Sara", "Martina", "Karin", "Akiko", "Anna"], "pub_date": "2007-07-22T00:00:00Z", "subject": ["Tennis"], "organizations": ["Palermo Open", "Western &#38; Southern Financial Group"], "news_desk": "Sports", "lead_paragraph": "Werner Eschauer of Austria and the qualifier Steve Darcis of Belgium advanced to the final of the Dutch Open yesterday in Amersfoort, Netherlands. Neither one has played for an ATP title before. Darcis, ranked 297th, upset the second-seeded Mikhail Youzhny, 4-6, 6-0, 7-5, and Eschauer defeated Robin Haase, 6-4, 6-4, in the semifinals.At the clay-court Palermo Open in Italy, the 18-year-old Agnes Szavay reached her first career final by beating Sara Errani, 7-6 (0), 6-1, in the semifinals. Szavay, seeded eighth, will face the second-seeded Martina M&#252;ller in the final today. M&#252;ller defeated Karin Knapp, 6-4, 4-6, 6-1.At the Western &#38; Southern Financial Group Women&#8217;s Open in Mason, Ohio, Akiko Morigami earned her second berth in a final in three years by outlasting the qualifier Akgul Amanmuradova, 6-7 (8), 6-4, 6-3. She will play the top-seeded Anna Chakvetadze in the final today. Chakvetadze advanced with a 6-2, 5-7, 6-3 win over the third-seeded Sania Mirza.", "snippet": "Werner Eschauer of Austria and the qualifier Steve Darcis of Belgium advanced to the final of the Dutch Open yesterday in Amersfoort, Netherlands. Neither one has played for an ATP title before. Darcis, ranked 297th, upset the second-seeded Mikhail...", "subsection_name": "Tennis", "male": ["Werner", "Steve", "Mikhail", "Robin"]}]