[{"anonymous": ["Rhodes"], "word_count": "128", "_id": "548c2bda79881004157bc8af", "persons": ["Dominic Rhodes", "Torrie Cox", "Rhodes", "LaMont Jordan.Cox"], "female": ["Torrie"], "pub_date": "2007-07-04T00:00:00Z", "subject": null, "organizations": ["Oakland Raiders", "Tampa Bay Buccaneers", "Raiders"], "news_desk": "Sports", "lead_paragraph": "Oakland Raiders running back Dominic Rhodes and Torrie Cox, the special-teams ace of the Tampa Bay Buccaneers, were suspended for the first four games of the season for violating the league\u2019s substance-abuse policy. The league does not disclose reasons for substance-abuse suspensions. Rhodes pleaded guilty in the off-season to reckless driving charges in Indiana after prosecutors agreed to drop drunken driving charges against him.Rhodes, who spent his six seasons in Indianapolis, signed a two-year contract with the Raiders that could be worth up to $7.5 million. He is expected to split time with last year\u2019s starter, LaMont Jordan.Cox was picked as a Pro Bowl alternate last season, when he returned 18 kickoffs for 387 yards and made 30 tackles. He can participate in all preseason practices and games.", "snippet": "Oakland Raiders running back Dominic Rhodes and Torrie Cox, the special-teams ace of the Tampa Bay Buccaneers, were suspended for the first four games of the season for violating the league\u2019s substance-abuse policy. The league does not disclose...", "subsection_name": "Pro Football", "male": ["Dominic", "LaMont"]}]