[{"anonymous": ["Rodr\u00edguez", "Yuniesky", "Rodr\u00edguez", "Betancourt", "Beltre"], "word_count": "135", "_id": "548c9918798810543aba45c1", "persons": ["Iv\u00e1n Rodr\u00edguez", "Rodr\u00edguez", "Adri\u00e1n Beltre", "Yuniesky Betancourt", "Rodr\u00edguez", "Betancourt", "Beltre", "Mike Winters"], "female": [], "pub_date": "2007-07-15T00:00:00Z", "subject": null, "organizations": ["Detroit Tigers", "Major League Baseball", "Seattle Mariners"], "news_desk": "Sports", "lead_paragraph": "Detroit Tigers catcher Iv\u00e1n Rodr\u00edguez was suspended yesterday for one game by Major League Baseball for his conduct during a game against the Seattle Mariners on Thursday.Rodr\u00edguez, who was also fined an undisclosed amount, was ejected from Thursday\u2019s game in the fourth inning for arguing that he was interfered with while trying to throw out a base stealer.As Rodr\u00edguez, a 14-time All-Star, was trying to throw out Adri\u00e1n Beltre at second base, the batter, Yuniesky Betancourt, was bent over and astride the plate. Rodr\u00edguez avoided making contact with Betancourt, but his throw sailed over second base and into center field for an error that allowed Beltre to advance to third.Rodr\u00edguez then began arguing with the plate umpire Mike Winters and at one point appeared to come close to bumping him \u2014 if not making contact.", "snippet": "Detroit Tigers catcher Iv\u00e1n Rodr\u00edguez was suspended yesterday for one game by Major League Baseball for his conduct during a game against the Seattle Mariners on Thursday.Rodr\u00edguez, who was also fined an undisclosed amount, was ejected from...", "subsection_name": "Baseball", "male": ["Iv\u00e1n", "Adri\u00e1n", "Mike"]}]