[{"anonymous": [], "word_count": "150", "_id": "548c07fe79881004157bc587", "persons": ["Scott Nichol", "Alex Henry", "David Poile", "Henry", "Nichol", "Henry", "Henry"], "female": ["Nichol"], "pub_date": "2007-07-01T00:00:00Z", "subject": null, "organizations": ["Predators.Nichol", "N.H.L.", "Milwaukee of the American Hockey League", "N.H.L."], "news_desk": "Sports", "lead_paragraph": "Nashville center Scott Nichol and defenseman Alex Henry have agreed to contract terms with the Predators.Nichol signed a two-year deal that will pay him $750,000 each season, General Manager David Poile said yesterday. Henry signed a one-year contract that will pay him $100,000 at the minor league level and $475,000 at the N.H.L. level.Nicol played in 59 games for the Predators last season, posting 13 points (7 goals and 6 assists) and 79 penalty minutes. In 301 career N.H.L. games with Nashville, Chicago, Calgary and Buffalo, Nichol has posted 64 points (30 goals, 34 assists) and 573 penalty minutes.Henry played in 64 games with Milwaukee of the American Hockey League last season, getting one goal, six assists and 66 penalty minutes.Before joining the Predators last season, Henry played two seasons with Minnesota. Henry has 11 points and 259 penalty minutes in 175 career N.H.L. games with Minnesota, Edmonton and Washington.", "snippet": "Nashville center Scott Nichol and defenseman Alex Henry have agreed to contract terms with the Predators.Nichol signed a two-year deal that will pay him $750,000 each season, General Manager David Poile said yesterday. Henry signed a one-year...", "subsection_name": "Hockey", "male": ["Scott", "Alex", "David", "Henry", "Henry", "Henry"]}]