[{"anonymous": ["Schoenfeld", "Schoenfeld"], "word_count": "117", "_id": "548cf1f7798810543aba4d7f", "persons": ["Jim Schoenfeld", "Don Maloney", "Schoenfeld", "Ken Gernander", "Schoenfeld", "Cameron Hope", "Jim", "Glen Sather"], "female": [], "pub_date": "2007-07-24T00:00:00Z", "subject": null, "organizations": ["Rangers", "Phoenix Coyotes", "Hartford Wolf Pack", "Rangers", "American Hockey League", "Rangers"], "news_desk": "Sports", "lead_paragraph": "The Rangers promoted Jim Schoenfeld to assistant general manager. He replaces Don Maloney, who became general manager of the Phoenix Coyotes last month. Schoenfeld will remain the general manager of the Hartford Wolf Pack, the Rangers&#8217; American Hockey League affiliate, a position he has held for four seasons.He will no longer coach the Wolf Pack; Ken Gernander was hired to replace him. Schoenfeld will be the assistant general manager for player personnel; Cameron Hope will serve as assistant general manager for hockey administration.&#8220;Our organizational philosophy is to build within, and Jim&#8217;s keen eye for talent at every level has proven successful in building our organization,&#8221; Glen Sather, the Rangers&#8217; president and general manager, said in a statement.", "snippet": "The Rangers promoted Jim Schoenfeld to assistant general manager. He replaces Don Maloney, who became general manager of the Phoenix Coyotes last month. Schoenfeld will remain the general manager of the Hartford Wolf Pack, the Rangers&#8217; American...", "subsection_name": "Hockey", "male": ["Jim", "Don", "Ken", "Cameron", "Jim", "Glen"]}]