[{"anonymous": ["DiMartino"], "word_count": "128", "_id": "5467f2dd79881054c64b0702", "persons": ["Tina DiMartino", "DiMartino", "Natasha Kais", "Angie Woznuk", "Edwin van der Sar", "Peter Lovenkrands"], "female": ["Tina", "Natasha", "Angie"], "pub_date": "2009-03-05T00:00:00Z", "subject": ["Soccer"], "organizations": ["Manchester United"], "news_desk": "Sports", "lead_paragraph": "Tina DiMartino scored her first senior international goal Wednesday to help the defending champion United States beat Denmark, 2-0, in the Algarve Cup in Lagos, Portugal. DiMartino, making her second appearance, knocked in the ball from short range in the 35th minute after Natasha Kai\u2019s header rebounded off the post. Angie Woznuk scored the first goal for the Americans in the 22nd minute. The United States beat Denmark in the last two finals and has won the title six times in the last eight years. algarve \u00b6Manchester United goalkeeper Edwin van der Sar had his English league record of not allowing a goal stopped at 1,311 minutes after he failed to hold a shot and Peter Lovenkrands gave Newcastle the lead. The Red Devils rallied for a 2-1 victory. goalie.", "snippet": "Tina DiMartino scored her first senior international goal Wednesday to help the defending champion United States beat Denmark, 2-0, in the Algarve Cup in Lagos, Portugal. DiMartino, making her second appearance, knocked in the ball from short range...", "subsection_name": "Soccer", "male": ["Edwin", "Peter"]}]