[{"anonymous": ["Snow"], "word_count": "154", "_id": "56503b2879881035d3c46494", "persons": ["Snow White", "Freya", "Freya", "Eric", "Sara", "Freya"], "female": ["Freya", "Freya", "Sara", "Freya"], "pub_date": "2015-11-21T04:36:11Z", "subject": null, "organizations": ["Magic Mirror"], "news_desk": "Movies", "lead_paragraph": "Long before the evil Queen Ravenna was thought vanquished by Snow White's blade, she watched silently as her sister, Freya, suffered a heartbreaking betrayal and fled their kingdom. With Freya's ability to freeze any enemy, the young ice queen has spent decades in a remote wintry palace raising a legion of deadly huntsmen-including Eric and warrior Sara -only to find that her prized two defied her one demand: Forever harden your hearts to love. When Freya learns of her sister's demise, she summons her remaining soldiers to bring the Magic Mirror home to the only sorceress left who can harness its power. But once she discovers Ravenna can be resurrected from its golden depths, the wicked sisters threaten this enchanted land with twice the darkest force it's ever seen. Now, their amassing army shall prove undefeatable unless the banished huntsmen who broke their queen's cardinal rule can fight their way back to one another.", "snippet": "Long before the evil Queen Ravenna was thought vanquished by Snow White's blade, she watched silently as her sister, Freya, suffered a heartbreaking betrayal and fled their kingdom. With Freya's ability to freeze any enemy, the young ice queen has...", "subsection_name": null, "male": ["Eric"]}]