[{"anonymous": ["Lequisa"], "word_count": "141", "_id": "5487f5b2798810726e2d3a11", "persons": ["Stacy", "Shelly", "Ellen Stacy", "Lequisa", "Bronson", "Ellie", "Adam W. Wayman"], "female": ["Stacy", "Shelly", "Ellen", "Ellie"], "pub_date": "2007-11-21T00:00:00Z", "subject": ["Accidents and Safety"], "organizations": ["Philadelphia Eagles"], "news_desk": "Sports", "lead_paragraph": "A van driven by the former Alabama star running back Siran Stacy was struck by a pickup truck at an intersection in Dothan, Ala., late Monday. Six people were killed, including Stacy\u2019s wife and four of his children, the police said. The driver of the second vehicle was also killed. The police said the pickup was on the wrong side of the four-lane road when it struck Stacy\u2019s van on the passenger side.Stacy, 39, the first pick of the Philadelphia Eagles in the 1992 draft, was listed in stable condition in surgical intensive care in Dothan. His 3-year-old daughter, Shelly, was taken to Children\u2019s Hospital in Birmingham, which did not release her condition.The victims were identified as Stacy\u2019s wife, Ellen Stacy, 36; their children, Lequisa, 18; Bronson, 10; Sidney, 8; and Ellie, 2; and the other driver, Adam W. Wayman, 29.", "snippet": "A van driven by the former Alabama star running back Siran Stacy was struck by a pickup truck at an intersection in Dothan, Ala., late Monday. Six people were killed, including Stacy\u2019s wife and four of his children, the police said. The driver of...", "subsection_name": "College Football", "male": ["Bronson", "Adam"]}]