[{"anonymous": ["Boo", "Slocum", "Weekley"], "word_count": "125", "_id": "5488091d798810726e2d3bcd", "persons": ["Boo Weekley", "Heath Slocum", "Alex Cejka", "Martin Kaymer", "Slocum", "Weekley"], "female": [], "pub_date": "2007-11-23T00:00:00Z", "subject": ["Golf"], "organizations": null, "news_desk": "Sports", "lead_paragraph": "Boo Weekley and Heath Slocum of the United States combined for an 11-under-par 61 in best-ball play to take a one-stroke lead over Alex Cejka and Martin Kaymer of Germany at the World Cup of Golf in Shenzhen, China. Finland, Wales, Scotland, South Africa, Thailand and England were two shots back.Weekley, No. 43 in the world, had six birdies and an eagle. He was picked to represent the United States after 13 other higher-ranked Americans turned down the invitation. He picked the 70th-ranked Slocum, his friend from high school in Florida.\u201cI think I was up in a tree deer hunting when I got the call,\u201d Weekley said.The teams will play an alternate-shot round today, another best-ball round tomorrow and then close with alternate shot Sunday.", "snippet": "Boo Weekley and Heath Slocum of the United States combined for an 11-under-par 61 in best-ball play to take a one-stroke lead over Alex Cejka and Martin Kaymer of Germany at the World Cup of Golf in Shenzhen, China. Finland, Wales, Scotland, South...", "subsection_name": "Golf", "male": ["Heath", "Alex", "Martin"]}]