[{"anonymous": ["Jozy", "Bucero", "Jozys", "Motzkin"], "word_count": "127", "_id": "548812e7798810726e2d3cae", "persons": ["Carlos Bucero", "Jozy Altidore.Altidores", "Richard Motzkin", "Bucero", "Jozys", "Motzkin"], "female": [], "pub_date": "2007-11-24T00:00:00Z", "subject": ["Soccer"], "organizations": ["Real Madrid"], "news_desk": "Sports", "lead_paragraph": "The Real Madrid sporting director assistant Carlos Bucero traveled to New York amid reports that the team was interested in signing the 18-year-old Red Bulls striker Jozy Altidore.Altidore\u2019s agent, Richard Motzkin, would not say if he had met with Bucero, but he confirmed Altidore\u2019s interest in Madrid.\u201cWe\u2019ve heard of the interest, and for any soccer player it is a thrill to be linked with Real Madrid, and Jozy\u2019s really happy about the news,\u201d Motzkin said.Altidore made his United States national team debut in a 1-0 friendly victory against South Africa on Nov. 17.He scored four goals as the United States reached the quarterfinals at the under-20 World Cup earlier this year, and had nine goals in 22 games in Major League Soccer this season.", "snippet": "The Real Madrid sporting director assistant Carlos Bucero traveled to New York amid reports that the team was interested in signing the 18-year-old Red Bulls striker Jozy Altidore.Altidore\u2019s agent, Richard Motzkin, would not say if he had met with...", "subsection_name": "Soccer", "male": ["Carlos", "Richard"]}]