[{"anonymous": ["Cherepanov"], "word_count": "110", "_id": "5479a91479881051996691fc", "persons": ["Alexei Cherepanov", "Vladimir Karpenko", "Cherepanov", "Patrick Kane"], "female": [], "pub_date": "2008-11-01T00:00:00Z", "subject": ["Hockey, Ice"], "organizations": ["New York Rangers"], "news_desk": "Sports", "lead_paragraph": "Alexei Cherepanov, the 19-year-old Rangers draft pick who died after collapsing in a game, was playing illegally for his Russian club, a top military officer said. Cherepanov\u2019s death Oct. 13 prompted outrage among lawmakers and Russian sports officials, with many calling for an investigation into the cause of the heart problems that led to his death at a Continental Hockey League game. Col. Vladimir Karpenko, a spokesman for the commander of Russia\u2019s Railway Troops, said on the state-run First Channel that Cherepanov should have been serving his mandatory military service. \u00b6Patrick Kane had a goal and an assist as the host Chicago Blackhawks beat the Dallas Stars, 5-2. blackhawks (AP).", "snippet": "Alexei Cherepanov, the 19-year-old Rangers draft pick who died after collapsing in a game, was playing illegally for his Russian club, a top military officer said. Cherepanov\u2019s death Oct. 13 prompted outrage among lawmakers and Russian sports...", "subsection_name": "Hockey", "male": ["Alexei", "Vladimir", "Patrick"]}]