[{"anonymous": ["Cha"], "word_count": "103", "_id": "54819bd77988103739e18340", "persons": ["Landon Donovan", "Donovan", "Cha Bum-Kun", "Sami al-Jaber", "Mohammed al-Deayea"], "female": [], "pub_date": "2008-05-21T00:00:00Z", "subject": null, "organizations": ["United States Soccer Federation"], "news_desk": "Sports", "lead_paragraph": "Landon Donovan was among 22 players picked for the United States men&#8217;s national team&#8217;s exhibition game at England next week and could make his 100th international appearance. Donovan, who leads the United States with 35 career goals, will be 26 years 2 months 24 days old when the Americans play at Wembley next Wednesday. According to the United States Soccer Federation, the only men to reach 100 appearances for their country at a younger age were South Korea&#8217;s Cha Bum-Kun, who was 24 when he reached 100 in 1977; and Saudi Arabia&#8217;s Sami al-Jaber and Mohammed al-Deayea, who were each 25 in 1998.", "snippet": "Landon Donovan was among 22 players picked for the United States men&#8217;s national team&#8217;s exhibition game at England next week and could make his 100th international appearance. Donovan, who leads the United States with 35 career goals, will...", "subsection_name": "Soccer", "male": ["Landon", "Donovan", "Sami", "Mohammed"]}]