[{"anonymous": ["Vaughns", "Imus"], "word_count": "125", "_id": "54851c2279881040e1d4b523", "persons": ["Kia Vaughn", "Don Imus", "Kia Vaughn", "Marti McKenzie", "Vaughns", "Richard Ancowitz", "Imus", "Martin Garbus", "Vaughn"], "female": ["Kia", "Kia", "Marti"], "pub_date": "2007-09-12T00:00:00Z", "subject": null, "organizations": ["Rutgers womens", "CBS Radio", "Supreme Court", "Rutgers University", "Imus"], "news_desk": "Sports", "lead_paragraph": "Kia Vaughn, the Rutgers women\u2019s basketball player who filed a defamation lawsuit last month against Don Imus and CBS Radio, among others, over his reference to the team as \u201cnappy-headed hos,\u201d has withdrawn her suit, according to a filing she made yesterday in state Supreme Court in the Bronx. \u201cLast week Kia Vaughn returned to Rutgers University to focus upon both her academic pursuits as a journalism major and upon her basketball team,\u201d Marti McKenzie, a spokeswoman for Vaughn\u2019s lawyer, Richard Ancowitz, said in a statement. \u201cHer strong commitments to both have influenced her decision to withdraw the lawsuit at this time.\u201d A lawyer for Imus, Martin Garbus, said yesterday that he had no comment, other than that Imus had paid no money to Vaughn.", "snippet": "Kia Vaughn, the Rutgers women\u2019s basketball player who filed a defamation lawsuit last month against Don Imus and CBS Radio, among others, over his reference to the team as \u201cnappy-headed hos,\u201d has withdrawn her suit, according to a filing she...", "subsection_name": "College Basketball", "male": ["Don", "Richard", "Martin", "Vaughn"]}]