[{"anonymous": ["Hill", "Beinfest", "Jennings", "Fleming", "Hill", "Beinfest"], "word_count": "107", "_id": "5485ad4979881040e1d4c642", "persons": ["Michael Hill", "Larry Beinfest", "Dan Jennings", "Jim Fleming", "Hill", "Beinfest", "Jennings", "Fleming", "Hill", "Beinfest"], "female": [], "pub_date": "2007-09-30T00:00:00Z", "subject": null, "organizations": ["Florida Marlins", "Marlins", "Marlins", "Marlins"], "news_desk": "Sports", "lead_paragraph": "Michael Hill was named general manager of the Florida Marlins yesterday, replacing Larry Beinfest, who became president of baseball operations.The Marlins also named Dan Jennings and Jim Fleming as assistant general managers, adding to their roles in the team\u2019s player personnel and development departments. Hill, Beinfest, Jennings and Fleming all accepted extensions, keeping them under contract for at least the next eight seasons.Beinfest was named the Marlins\u2019 general manager before the 2002 season and helped Florida put together the team that won the World Series in 2003. Hill becomes the third general manager in Marlins history. He had been an assistant general manager under Beinfest since 2002.", "snippet": "Michael Hill was named general manager of the Florida Marlins yesterday, replacing Larry Beinfest, who became president of baseball operations.The Marlins also named Dan Jennings and Jim Fleming as assistant general managers, adding to their roles in...", "subsection_name": "Baseball", "male": ["Michael", "Larry", "Dan", "Jim"]}]