[{"anonymous": ["Xie", "Xie", "Xies"], "word_count": "99", "_id": "5477c6ac79881006dca8b2df", "persons": ["Xie Yalong", "Xie", "Nan Yong", "Xies"], "female": ["Nan"], "pub_date": "2008-09-11T00:00:00Z", "subject": ["Soccer"], "organizations": ["Chinese Football Association", "Communist Party"], "news_desk": "Sports", "lead_paragraph": "The Chinese Football Association announced that its chairman, Xie Yalong, was taking a leave to attend government management school. The move came in the face of widespread criticism of Xie, who is often blamed by fans for the dismal performance of the Chinese men\u2019s national and Olympic teams. Soccer is the favorite sport in China, but the men\u2019s teams continue to disappoint fans, who say the association is awash in corruption. On its Web site, the association on Wednesday said Nan Yong, the vice chairman and the association\u2019s Communist Party secretary, would take Xie\u2019s place while he was away.", "snippet": "The Chinese Football Association announced that its chairman, Xie Yalong, was taking a leave to attend government management school. The move came in the face of widespread criticism of Xie, who is often blamed by fans for the dismal performance of...", "subsection_name": "Soccer", "male": []}]