[{"anonymous": ["Davydenko", "Arguello", "Davydenko"], "word_count": "107", "_id": "5483f40f7988106fd483d334", "persons": ["Nikolay Davydenko", "Davydenko", "Martin Vassallo Arguello", "Arguello", "Davydenko"], "female": [], "pub_date": "2007-08-04T00:00:00Z", "subject": ["Tennis", "Gambling"], "organizations": ["Betfair", "Betfair"], "news_desk": "Sports", "lead_paragraph": "Officials yesterday were investigating suspicious betting patterns on a match involving Nikolay Davydenko of Russia, who retired with an injury against a low-ranked opponent at an ATP tournament in Poland. In an unprecedented move, the British online gambling company Betfair voided all bets placed on Thursday&#8217;s second-round match at the Prokom Open in Sopot between the No. 4-ranked Davydenko, the top seed, and No. 87-ranked Martin Vassallo Arguello of Argentina. Betfair said it received about $7 million in bets on the match &#151; 10 times the usual amount &#151; and most of the money was on Arguello to win, even after Davydenko won the first set, 6-2.", "snippet": "Officials yesterday were investigating suspicious betting patterns on a match involving Nikolay Davydenko of Russia, who retired with an injury against a low-ranked opponent at an ATP tournament in Poland. In an unprecedented move, the British online...", "subsection_name": null, "male": ["Nikolay", "Martin"]}]