[{"anonymous": ["Torres"], "word_count": "112", "_id": "5483e0737988106fd483d0e0", "persons": ["Michael Phelps", "Ryan Lochte", "Torres", "Amanda Weir", "David Walters"], "female": ["Amanda"], "pub_date": "2007-08-02T00:00:00Z", "subject": null, "organizations": ["Indiana University Natatorium"], "news_desk": "Sports", "lead_paragraph": "Michael Phelps won two titles yesterday at the national swimming championships and barely missed a world record in the 200-meter backstroke.Phelps, who scheduled an ambitious 10-event program at the Indiana University Natatorium, failed to qualify for the final of the 200 breaststroke. But he won the 200 backstroke in 1 minute 54.65 seconds, just .33 seconds off the world record of 1:54.32 set by Ryan Lochte at the world championships in March. He later helped Michigan win the 4x100-freestyle relay.Dana Torres, a 40-year-old mother trying to qualify for her fifth Olympics, won the 100 women\u2019s freestyle in 54.45 seconds, beating Amanda Weir. David Walters won the men\u2019s 100 freestyle in 48.96 seconds.", "snippet": "Michael Phelps won two titles yesterday at the national swimming championships and barely missed a world record in the 200-meter backstroke.Phelps, who scheduled an ambitious 10-event program at the Indiana University Natatorium, failed to qualify...", "subsection_name": "More Sports", "male": ["Michael", "Ryan", "David"]}]