[{"anonymous": ["Dalilah", "Nadonna"], "word_count": "121", "_id": "547e59737988107cec11b433", "persons": ["Dalilah Muhammad", "Muhammad", "Donald Williams", "Nadonna Rodrigues"], "female": [], "pub_date": "2008-02-23T00:00:00Z", "subject": ["Track and Field"], "organizations": ["Cardozo High School of Queens", "Public Schools Athletic League", "Brooklyns Boys & Girls"], "news_desk": "Sports", "lead_paragraph": "Dalilah Muhammad led Cardozo High School of Queens to the girls\u2019 team title with 78 points in the Public Schools Athletic League indoor championships at the New Balance Track and Field Center in Upper Manhattan. Muhammad won the high jump, finished second in the 55-meter hurdles and was third leg on Cardozo\u2019s 4x800 winning relay (9:27.11). Midwood of Brooklyn captured the boys\u2019 team crown with 51 points. Donald Williams paced Midwood with a victory in the 55-meter dash and ran second on Midwood\u2019s winning 4x400 relay (3:28.60). Nadonna Rodrigues of Brooklyn\u2019s Boys & Girls, who recently posted the fastest 400-meter time in the country at 52.83 seconds, took the 300 in 38.39 seconds and anchored her school\u2019s winning 4x400 foursome (3:56.83).", "snippet": "Dalilah Muhammad led Cardozo High School of Queens to the girls\u2019 team title with 78 points in the Public Schools Athletic League indoor championships at the New Balance Track and Field Center in Upper Manhattan. Muhammad won the high jump, finished...", "subsection_name": "More Sports", "male": ["Muhammad", "Donald"]}]