[{"anonymous": ["Lazio", "Lazio", "A.C."], "word_count": "118", "_id": "54ae93b57988105cf60962de", "persons": ["Roberto Patriarca", "Lazio", "Lazio", "A.C. Milan"], "female": [], "pub_date": "2006-07-19T00:00:00Z", "subject": null, "organizations": ["Juventus", "Fiorentina", "A.C. Milan", "Juventus", "Fiorentina", "Juventus", "Fiorentina", "Lazio"], "news_desk": "Sports", "lead_paragraph": "Juventus has appealed its demotion to Serie B and the loss of two Serie A titles in Italy\u2019s match-fixing scandal. The club argued that the sanctions were excessive, a club spokesman, Roberto Patriarca, said yesterday. Lazio, Fiorentina and A.C. Milan confirmed yesterday that they would also appeal. The appeals hearing will begin Saturday, the Italian soccer federation said. An Italian sports tribunal on Friday relegated Juventus, Lazio and Fiorentina to the second division. A.C. Milan escaped demotion but was given a 15-point penalty and banned from European play for the coming season. Juventus received a 30-point penalty, Fiorentina 12 points and Lazio 7. The tribunal also sanctioned 19 former officials and referees for influencing the outcome of matches.", "snippet": "Juventus has appealed its demotion to Serie B and the loss of two Serie A titles in Italy\u2019s match-fixing scandal. The club argued that the sanctions were excessive, a club spokesman, Roberto Patriarca, said yesterday. Lazio, Fiorentina and A.C....", "subsection_name": "Soccer", "male": ["Roberto"]}]