[{"anonymous": ["Arguello", "Daysi", "Torrez", "Arguello"], "word_count": "110", "_id": "547ee1fa7988107cec11c0b8", "persons": ["Alexis Arguello", "Arguello", "Daysi Torrez", "Torrez", "Arguello"], "female": [], "pub_date": "2008-03-08T00:00:00Z", "subject": ["Boxing"], "organizations": ["Sandinista National Liberation Front", "International Boxing Hall of Fame", "AP"], "news_desk": "Sports", "lead_paragraph": "The former three-time world champion Alexis Arguello has been nominated by the Sandinista party to run for mayor of Managua, Nicaragua&#8217;s capital. Arguello was approved as a precandidate for the November elections at a meeting of the Sandinista National Liberation Front, according to Daysi Torrez, a journalist who was nominated to run for deputy mayor. The selections will be ratified on Sunday by the party&#8217;s top decision-making council, and the candidates will be officially presented next week, Torrez said. Arguello, a former featherweight and lightweight champion, retired in 1995 with 80 wins in 88 fights, 64 by knockout. He was inducted into the International Boxing Hall of Fame in 1992.(AP).", "snippet": "The former three-time world champion Alexis Arguello has been nominated by the Sandinista party to run for mayor of Managua, Nicaragua&#8217;s capital. Arguello was approved as a precandidate for the November elections at a meeting of the Sandinista...", "subsection_name": "More Sports", "male": ["Alexis"]}]